{"$id":"https://inferswarm.dev/schema/issue109/core-threshold-manifest-1.json","$schema":"https://json-schema.org/draft/2020-12/schema","additionalProperties":false,"properties":{"comparator_tier_contract_sha256":{"pattern":"^[0-9a-f]{64}$","type":"string"},"contract_id":{"const":"inferswarm.gemma4-mixture-population-qualification/1"},"holdout_state":{"const":"SEALED_NOT_CONSUMED"},"limits":{"additionalProperties":false,"properties":{"decision_local_E_D":{"additionalProperties":false,"properties":{"comparison":{"const":"observed<=limit"},"limit_hex":{"pattern":"^0x[0-9a-f.]+p[+-][0-9]+$","type":"string"},"rule":{"const":"max(statistical_max,stress_max)"},"statistical_max_hex":{"pattern":"^0x[0-9a-f.]+p[+-][0-9]+$","type":"string"},"stress_max_hex":{"pattern":"^0x[0-9a-f.]+p[+-][0-9]+$","type":"string"}},"required":["statistical_max_hex","stress_max_hex","limit_hex","rule","comparison"],"type":"object"},"fp32-consumer-logits:max-absolute-difference":{"additionalProperties":false,"properties":{"comparison":{"const":"observed<=limit"},"limit_hex":{"pattern":"^0x[0-9a-f.]+p[+-][0-9]+$","type":"string"},"rule":{"const":"max(statistical_max,stress_max)"},"statistical_max_hex":{"pattern":"^0x[0-9a-f.]+p[+-][0-9]+$","type":"string"},"stress_max_hex":{"pattern":"^0x[0-9a-f.]+p[+-][0-9]+$","type":"string"}},"required":["statistical_max_hex","stress_max_hex","limit_hex","rule","comparison"],"type":"object"},"fp32-consumer-logits:rms-difference":{"additionalProperties":false,"properties":{"comparison":{"const":"observed<=limit"},"limit_hex":{"pattern":"^0x[0-9a-f.]+p[+-][0-9]+$","type":"string"},"rule":{"const":"max(statistical_max,stress_max)"},"statistical_max_hex":{"pattern":"^0x[0-9a-f.]+p[+-][0-9]+$","type":"string"},"stress_max_hex":{"pattern":"^0x[0-9a-f.]+p[+-][0-9]+$","type":"string"}},"required":["statistical_max_hex","stress_max_hex","limit_hex","rule","comparison"],"type":"object"}},"required":["fp32-consumer-logits:max-absolute-difference","fp32-consumer-logits:rms-difference","decision_local_E_D"],"type":"object"},"manual_editing_or_rounding":{"const":"PROHIBITED"},"provenance":{"additionalProperties":false,"properties":{"argmax_tie_break":{"const":"ARGMAX_FIRST_MAX/lowest-token-id-among-exactly-equal-fp32-maxima"},"calibration_corpus_sha256":{"pattern":"^[0-9a-f]{64}$","type":"string"},"calibration_evidence_sha256":{"items":{"pattern":"^[0-9a-f]{64}$","type":"string"},"minItems":1,"type":"array","uniqueItems":true},"calibration_summary_sha256":{"pattern":"^[0-9a-f]{64}$","type":"string"},"decision_domain_manifest_sha256":{"pattern":"^[0-9a-f]{64}$","type":"string"},"derivation_program_sha256":{"pattern":"^[0-9a-f]{64}$","type":"string"},"holdout_commitment_sha256":{"pattern":"^[0-9a-f]{64}$","type":"string"},"holdout_custody_record_sha256":{"pattern":"^[0-9a-f]{64}$","type":"string"},"selected_stress_sha256":{"pattern":"^[0-9a-f]{64}$","type":"string"}},"required":["calibration_corpus_sha256","calibration_summary_sha256","calibration_evidence_sha256","selected_stress_sha256","decision_domain_manifest_sha256","derivation_program_sha256","holdout_commitment_sha256","holdout_custody_record_sha256","argmax_tie_break"],"type":"object"},"schema":{"const":"inferswarm.issue109.v5-core-threshold-manifest/1"}},"required":["schema","contract_id","comparator_tier_contract_sha256","provenance","limits","holdout_state","manual_editing_or_rounding"],"title":"InferSwarm issue #109 v5 three-identity conjunctive core threshold manifest","type":"object"}
