{"comparator_tier_contract_sha256":"ebba447573ea7af9faeab91e1036a780db453661fbc5eb067f6acfd78a1df5af","contract_id":"inferswarm.gemma4-mixture-population-qualification/1","holdout_state":"SEALED_NOT_CONSUMED","limits":{"decision_local_E_D":{"comparison":"observed<=limit","limit_hex":"0x1.d200000000000p+4","rule":"max(statistical_max,stress_max)","statistical_max_hex":"0x1.d200000000000p+4","stress_max_hex":"0x1.5e00000000000p+3"},"fp32-consumer-logits:max-absolute-difference":{"comparison":"observed<=limit","limit_hex":"0x1.d200000000000p+4","rule":"max(statistical_max,stress_max)","statistical_max_hex":"0x1.d200000000000p+4","stress_max_hex":"0x1.8100000000000p+3"},"fp32-consumer-logits:rms-difference":{"comparison":"observed<=limit","limit_hex":"0x1.7790ef6766a33p+3","rule":"max(statistical_max,stress_max)","statistical_max_hex":"0x1.7790ef6766a33p+3","stress_max_hex":"0x1.007ddb6e479b5p+1"}},"manual_editing_or_rounding":"PROHIBITED","provenance":{"argmax_tie_break":"ARGMAX_FIRST_MAX/lowest-token-id-among-exactly-equal-fp32-maxima","calibration_corpus_sha256":"b35f1915231d455cd964e9b645e58269ec63cdf483742907af39cc850f9fdb35","calibration_evidence_sha256":["002924f157de5274d3db9c272f75183bbcbcd8138760a23c690c7f0fb82cd380","004655c67b4f69e0c4ddb6194e9eb2e537ee62e0ff5dc6019673a827a05f7245","005b7e0167608fcddf21ccf68a66e2dfcf5857da1750b7488405e516a6d3300f","00802545257d5aae8e03448c3660e121794dabcc47b96b614724657923699a07","008ac70a89e1549399f03f4e9304c903a7e6217a29c4c6956b82cf5f25229a91","00bf34d8948bc300831b3d3843a016923a99f3bdd4c7defc17c62aa2feaf4a00","00c6a9b87deb8d5f31ca1d235b5c5309c2296c7709a17f3add9c0677495bd475","00c76138b8d447cb254100917f6f0b889559ea863b73511a3dd5bb1bebb189e7","0159cfd8e92eb504e525fff04cb30b1df25f25dd330e2fee70c7abb1d1572d1a","0174562b18e82356c19fa29b3d6e4788fc53adbf3c9a5dc9130fc4273437ec7a","017a8b00ccf463fee30baad18532b43d101beca44c1e0c5a3b0d9b9dcc725723","01ac24034f2e475b2ded12798235c07191036155c2fe580e3a8fb9cd0df5af4c","01d682da0b0f64d4c82743e0720f92bab7e97e9961676fd262dc35b7b87b67d0","023ee77127bc8f51933bc832f58e006158b8703f6a289b2827ac94cfc029df9d","0271074a51fe0f009163f50370db78a41c9e36f91de12b9083bdfd85e7d39fcd","027da117316fdd4d0b4fb220c9fa1bf005a8f99a417a41665ef3cb0a82e6edfc","02a1b28539bca9ab123f5169c26b4ed7c200d2089e81080efd3648331ea77bf4","02bd572202b5aa9b74e54f67602bd3d0d927b8cf51e6149eabba739cf5711ff9","0329b7cf64402f8e5b3671310138742a3e5f70d0b4f7bff935ba884eed18f7fc","03451976ac1be42a8b99b86c1730e0ad156bee55737fa53b0d199c3ce27a96e1","03af306d9cc52926c1190b2f8baead0736686c1d9100dc0ed700881e7413df55","03c8ad18d8eca1fc25377a4ced20f790d7a8659b3ae55ad1b726ce8707906bc4","03d0cf1eeb234fd901d5cd10d264c4c2eeb089ccc281ad0835ae12b10bc53743","0417fa06d9a3f55024639b1ec5bfb4ac5f3dbddc9d964b870532207a4bd22cbf","04279ca9763edd635bb6e92714a96c41e3cc47ad394f0d0ef9fef0c41dc85e4a","0463504e5dabfe2d1506302359f7685fc1467dfdfb2102a252dd164f1f0276cf","048a1405b17eb84f2e9a5572aceba555c383dc0bf1ac6368d684fff96d8de0de","04ab78d130c09a02d3f5eb9fa8b48bf74abb03303b359f06d9ccc730792a9573","052fe21130873ea8dd2918e72334fb40a9598d857c5cac21500c97b4181cbbe9","055a249bb666fdb730221f4054de76d07f1ca508cfd2ee6c16267a1f84469c8e","055c5e189a10e9eab1481f7ebdeed3a24c1c2ec92dc643aa117b4d96ac7766a3","05ca7f8b53077f3c7f8c9cca1bf01af49dbfb20ca40d8338d4e1b01ec8e175ea","05e163e195ed40fd10c6658376a9ea4e032c304b4000130a8bf8776e1358faf9","05e6f87512bac335cd1b510ddc26cbed98e23b55b58e7a1fd5ee7aa634dbbe9c","06019069572f892c3cfca37d9aec4ded3f396d467871584ddabb32613c9c5e46","067d1ea7f6b64b8d64e6838c0cd8594314f258dd0388ad18a72d397365d4287d","067d8a44e3ccf01d9cb2a9914dc0425318cb781aa2452191ec5dd7eb5f673332","0686baf77c167e024303a071f92d513bf6dd422bced4346bc19e409552c18c08","06a88ce5023da8f3754acf269987bb03c863139545899869fff4cce6b9b6ee16","0733f47f5dbfeb08522884117b54c22db723851a9eace412d61f6b4891bcd64a","078e71a48f9810d38f8096b9b6f836787c0556f99eb9398d55a9d29851ce6f77","07bb512576f90ad7ce62e6f70bfb7d03facb1a5f42d8d6cd57a524748e14e7ae","07e8f5ce7550452d3ad3ed63176481d81bcb69904b9d12e1daca2384aeed6bc4","0807d0d09d0a8e7cb6cdea500321a9d6cc373d45ce4493e3c98f34d177a655fe","08123a9ee386e66ee2d14304e5ea83d31495f5e255a96f21583b575fff525212","0831ffb49e72963ab07ceb5af214119a111d3bb1ca5621cb94eb153dc2ea81ad","084a2f6fa78afd483fba68740c01f99749cc8f1d499fade64c5c5bbec61cb451","087ccc547a3c972486d06fd076ffd7423f1235adf7d654e18d808ed75bd90597","08b35ecbacc6cdf62c9b294afe91cc36fa5b4b84a7180fb8873736446803d6f9","0915e4df0c53b26e47f510057a80ff6357305197c8a1df4419b201d1fcf4aa34","09635f585fb0032052aec6103d771f41717e6c65ea37c7361f04e016523fe506","099985d6ca03cea379ff41222e810801838998fbcdb156815c2e019d3dd80984","09bf301c29a201b46fc29bc0f228c506c531a283023d249c9cde2df242e822a7","09c2b633de6b83b800cd521fcf6298eca663d43550b81cbca504202d77abb5cb","09e17f7aada20a2fb087483ee0f342cc17a88dd5d6971f80639c4a790a26eac9","09f2b4e5dbaff18c2680080c5ca8faa727bc8c62635b1750e4ba7503007b84bc","0a2197a6949db820fe76a6790a8d408c0e95126323cb9226f4d393e2a02e919f","0a25d8743779c622557e744d156be428ae00aaba1c25956fdc7c5a6bd2a1249c","0a533ee905c0e6b8df75bffe3a479c07a3a2ab00726dba89610807207359c3ad","0aaddefbe40f65ef8fd566084e97341a080c01f298967038b317a5011e2d67fb","0b03dace1902147894f32036d7da8c7a3b483729c99e1a57b3a645de8f0850e9","0b18c47a34f59f408823274a6d473d7236d09e509c81fbc2316ef571ea57ecc8","0b54c764ed45c1ec338adb2064201734456b176422a2824e977b1adbaa883e32","0b5dae4870595b49e534d292ba7336488bcbab84ba76c36518e206816d60ff34","0b8b3afdfffc3d747f59e838c535286994023240ab7448abfc683e9fb79474f4","0beb53fbe6f76a2893ca49ca98e24843bd3ded7917518f8161bd02eb22175685","0bed548ba2607d0d269d22d185757d0b927d1ee8f6597092ba17341cbb8dcc69","0bfd4446868afc7de7a77c34587e99b9ef286f05c82491264ca826c40cfe52c7","0c1637041de0ab7b311cca15219143de77bf3ab47d50f0d6346ece2fe7d5825c","0c321efe768e9acc7208e6ae17b34b00dbb1b0db0474d41983dfc00b61b39bbf","0c7f669e1e66fd45318214ab49faefac3d5663b58c65dd00facbd8744d597228","0cb3f46068656bedfb031ca3c879ec9bcd7b0a77344ce1d55dbecf808837f3eb","0cb7793ce565137312cc049a324b24305a7d4ec2bc700c97f79956ae18b2a841","0d173f06fa889891c78932dc90c7862364dd749c3d5371bec410cc3b626c6ccf","0d6394d71706c78b76e731a4ea05dc093a40a7aef8df0361aa90b5a6c633517e","0d963981873b0105f5762d5a2901247a8afd75fd68d7449aabe1d8dd22a9bea8","0d9d4031325f9524fb7206814fceae3b78179090f9df2194236c6f2ca0c47f35","0dd9c0417963ef4a75a151433d8003458ba356d972729c8bdfb24aba79150ef2","0de70f36f5fdbba9a8fd66a017b1f6211056419bd5216999ee4095590a65ac93","0e0daaf37ab885386a87d10f2484baae2183e3d87ec1d5db3b3b68892a8164fe","0e245e5d5363a7158e11f41d9ad278382ff5cb31be857465d7f9350d55b28672","0e3595e12b42e177e28e880c3c6c3cf91b74badbb57481af039dabe5c043a134","0e7fb1d459a1d24e394ff8ae9378b6b45aae57979b5681354a74f5c1bc53e3d8","0e80c39816fb7eb97ada39891f840a06b4011d4098a020db19c831d965134c6e","0e90214f6b60ab2f3e77753aae49c1f87b45cee54d804e1cd2e25b04aa4cd42d","0e9800512d652b3708522dae6b64c2b577695c8a6f054c7063acdcc50d5becdd","0ec232fcae7f48dc84f803c63a43eec93765262641df4a0f2b19935d40c610db","0efb8b9d17ebb4f71d8084f2ca870c8f4b27f18dff46698b71f85a6f7fdd244f","0f1d2bc503d0c86ced2a328e76979341e889724153ec0c6d2eafa59b4574d714","0f52d4090e074c7ff4dac3bbe0010a9d09665b9f092b4c0c88890af6f89fc2c9","0f5ab2e23b66349f5d20c3cde4b459f97fb26303b022aeaf21aa798120c93469","0f776bd1bb83edc9e243da49827d0b32c18b7ac812df9497b1d11e0ed6cbad7c","0f9845f430b34627735e971dab2cbe2b7d7ad0c47a342bcb3661afd7b1da1dd2","0fb1d485db1fb06a7fcb202ccbcc78dd0c30047661820202004f5e70dca5b5c3","0fbe37547b5af44e107955437a3e0ace1029be672bb0403c8a2599924469701d","0fec62a3f1a68827ff4809fe3886101398f23393041d81c490cfa06728c96e7b","1003a0faebb259b1647ec13b6c240f9a612d85d51b6e1c3a7ed12d12d4b6fd7d","1016f5d5d24dc660d7a9ef463c0d4c139a50503588f1b1f265ccc99ac73b5049","101bd5520b3ae530de6ffa0eebd4ee78b1b2aadc10a00516589549e3a7ce70df","1043cb689d25681b66c06a397ebc4785348872916af4e436945710fca1f818cb","1070df20ec2ec12c014939c8d0ddb259f7b6f3c362e00158a0a7037fb58e0be9","10a314178b88aedba02ede903bced471e12fdaa4b423e42713bdd56c55157ada","10c20f8e8e0d75db5d14f55aab7a0040d4f10ff9d9bc42973880b2e82509835f","10ff752358b1932b5d28ea905558cc76d107471c923b460758cefe0b52159d52","1116c311f02ab2b33e09aaf84cf17e86c70b4dd316fe54b4d66a663659d20888","112736c1a7e8aacda62886996b3044a639887fb0cee6190ce9aa76e3a2939741","11317b612771ae97eb1264b8c7a4d0a30eeee1a72504d60b2acd4f71e62ea0fd","116ab4af7d0b8258147a5e55d308452d915073bf18c9e2c6cc8fcfb3ccf51781","11b60e4830dda82d46e8bc65af1a1c930cd0ed96b4c9b7b1cc19108aec8ebdb6","11d85ba49f641e6575203881849656b3c3da1da64704d5ee9cb9741eba696baa","11ddb07b141aceb0900cb95d6bb5f346ceba04905dc0402035f9647ef9861cb7","121c239a2f7a917fb4d0c22f685bb04e8d4cf80fab9ea4be4be81d3617495680","12468069c7744506a22fc78ac7e046d720a28170f47dace8c9b01a5e5e0178dd","12595d68bef3a0102cddb4e3962e3ae86f88a547c2108ef191cae9f83fe179ac","126d2c6ee4343871411fe471b12f9b550e7729c7c8c70cb9420408b657ff1e0b","1289b6b20ac708f3219d6d525376941e4e478b552f44ea98597a1216c6e1b8ba","12b448667e3f164d2ef54ec2573fd2ca71982d3d31f63095e93860191ac89c6b","12c3aa5110ed7c0acf457f15bcbb6e8e1cc409ac374f6c948d0394d4ff85f59a","12e0a641eb594f42709d60bd3016c0cfb5a583002cedbe1650143cf2a7f085ca","1311e900e77640d3de4a239654018c4074861f69df59250fba271837da9d9062","131e4bf770e3d1add881c96feb372e3cd9a2410ef5920da4024bec878cda513d","1331412b2054325fcdd626deb4a6b20c645dfa40fe6b69a9a9ff99874f06619c","1356a762212c0263a4261da9a914b305a80b2a03711ff2bbfc3d1788e5db2451","136832fe7997855e11ce0158dc4ca52abae3cbd96aa1c16b43901a8c0a6e109c","13d50058c8e91c5a1e050537b5cb0a9b4e92dd854b189cbeb2cdcba58aec5683","147150e77f2d9fd26d746ebd4afc76f7a2750314cdb1a2b7eeb4c90b4d86bd6c","148701c346e8b32108a18112c5f3f0128c52f04c6827fb168918d7f134d3fc1e","14da9fe8ab984f5976b88b8af9f1bae84e1d0def65d2eb72a19b666e15924a5c","15151557cb77297d9083aa1a44e09474351f72cfce3c1970cc6b609593d35523","15ae58329dcebcfbcee6109638ac07b6a5bbc275d54ebf4422349c130a1624fa","15bbeb16555cd3c6e9831c34e768e930e01ad302b8be6e255bd06ea67d4e7cb0","15c09a11add0427d3a197560ee2e8d51db07db415f877e